municipio_nombre,municipio_id,objeto,establecimiento,nombre_establecimiento,longitud,latitud,
San Isidro,06756,Edificio de Cultura,Biblioteca Popular y Centro Cultural,Biblioteca Popular y Centro Cultural de Beccar,-58.547,-34.4715,
San Isidro,06756,Edificio de Cultura,Biblioteca Popular,Biblioteca Popular Club de madres de B.Sauce,-58.5477,-34.465,
San Isidro,06756,Edificio de Cultura,Biblioteca Popular,Biblioteca Popular Cava Joven,-58.5495,-34.4745,
San Isidro,06756,Edificio de Cultura,Biblioteca Popular,Biblioteca Popular Martín Güemes,-58.5501,-34.528,
San Isidro,06756,Edificio de Cultura,Museo,Museo de la Palabra,-58.5531,-34.5207,
San Miguel,06760,Edificio de Cultura,Biblioteca Popular,Biblioteca Popular Hist. E. I. Munzon,-58.6681,-34.5585,
San Miguel,06760,Edificio de Cultura,Biblioteca Popular,Biblioteca Popular Entre Todos,-58.688,-34.581,
San Miguel,06760,Edificio de Cultura,Museo,Museo Mariposas del Mundo,-58.704,-34.5401,
San Miguel,06760,Edificio de Cultura,Biblioteca Popular Municipal,Biblioteca Popular Municipal Domingo Faustino Sarmiento,-58.712,-34.5437,
San Miguel,06760,Edificio de Cultura,Biblioteca Popular,Biblioteca Popular El Faro,-58.7173,-34.5664,
San Nicolás,06763,Edificio de Cultura,Biblioteca Popular,Biblioteca Popular Barrio del Carmen,-60.209,-33.3543,
San Nicolás,06763,Edificio de Cultura,Museo y Biblioteca,Museo y Biblioteca de La Casa del Acuerdo de San Nicolás,-60.2164,-33.3298,
San Nicolás,06763,Edificio de Cultura,Biblioteca Popular,Biblioteca Popular Domingo Faustino Sarmiento,-60.2167,-33.3272,
San Nicolás,06763,Edificio de Cultura,Biblioteca Popular,Biblioteca Popular Rafael de Aguiar,-60.218,-33.3376,
San Nicolás,06763,Edificio de Cultura,Museo y Archivo Histórico Municipal,Museo y Archivo Histórico Municipal Don Gregorio Santiago Chervo,-60.221,-33.3272,
San Nicolás,06763,Edificio de Cultura,Biblioteca Popular,Biblioteca Popular Técnica de la Esc. Industrial,-60.2242,-33.335,
San Pedro,06770,Edificio de Cultura,Museo,Museo Fray José María Bottaro,-59.6617,-33.6757,
San Pedro,06770,Edificio de Cultura,Teatro,Teatro Municipal Siripo,-59.6631,-33.6781,
San Pedro,06770,Edificio de Cultura,Biblioteca Popular,Biblioteca Popular Rafael Obligado,-59.664,-33.6764,
San Pedro,06770,Edificio de Cultura,Cine Teatro,Cine Teatro La Palma,-59.668,-33.6787,
San Pedro,06770,Edificio de Cultura,Biblioteca Popular,Biblioteca Popular Domingo Faustino Sarmiento,-59.875,-33.881,
San Vicente,06778,Edificio de Cultura,Biblioteca Popular,Biblioteca Popular Domingo Faustino Sarmiento,-58.3832,-34.9745,
San Vicente,06778,Edificio de Cultura,Biblioteca Popular,Biblioteca Popular Bartolomé Mitre,-58.4228,-35.0247,
Suipacha,06784,Edificio de Cultura,Biblioteca Popular y Museo,Biblioteca Popular y Museo José Manuel Estrada,-59.6895,-34.7702,
Tandil,06791,Edificio de Cultura,Biblioteca Popular Escolar,Biblioteca Popular Escolar Juan José Castelli,-58.9169,-37.2519,
Tandil,06791,Edificio de Cultura,Biblioteca Popular,Biblioteca Popular Monseñor Luis J. Actis,-59.1125,-37.3222,
Tandil,06791,Edificio de Cultura,Biblioteca Popular,Biblioteca Popular de las Mujeres,-59.1201,-37.3363,
Tandil,06791,Edificio de Cultura,Biblioteca Popular,Biblioteca Popular Martín Fierro,-59.1238,-37.2952,
Tandil,06791,Edificio de Cultura,Biblioteca Popular y Sociedad de Fomento,Biblioteca Popular y Sociedad de Fomento Doctor Mariano Moreno,-59.1279,-37.3114,
Tandil,06791,Edificio de Cultura,Museo,Museo Histórico Fuerte Independencia,-59.1307,-37.3206,
Tandil,06791,Edificio de Cultura,Museo,Museo Tradicionalista del Fuerte,-59.1311,-37.3201,
Tandil,06791,Edificio de Cultura,Biblioteca Popular,Biblioteca Popular Juan Bautista Alberdi,-59.1358,-37.3154,
Tandil,06791,Edificio de Cultura,Biblioteca Popular,Biblioteca Popular Juan Antonio Salceda,-59.1364,-37.3144,
Tandil,06791,Edificio de Cultura,Teatro,Teatro Municipal del Fuerte,-59.1365,-37.33,
Tandil,06791,Edificio de Cultura,Biblioteca Popular,Biblioteca Popular Juan B. Justo,-59.1371,-37.3192,
Tandil,06791,Edificio de Cultura,Museo,Museo Municipal de Bellas Artes de Tandil (Mumbat),-59.1372,-37.3303,
Tandil,06791,Edificio de Cultura,Biblioteca Popular,Biblioteca Popular Bernardino Rivadavia,-59.1377,-37.3268,
Tandil,06791,Edificio de Cultura,Teatro,Teatro La Fábrica,-59.1388,-37.3288,
Tandil,06791,Edificio de Cultura,Biblioteca Popular Municipal,Biblioteca Popular Municipal Asociación Sala Abierta de Lectura Infanto Juvenil,-59.1401,-37.3257,
Tandil,06791,Edificio de Cultura,Biblioteca Popular,Biblioteca Popular Juan L. Vatuone,-59.1467,-37.3265,
Tandil,06791,Edificio de Cultura,Biblioteca Popular,Biblioteca Popular Ernesto Valor,-59.1559,-37.3188,
Tandil,06791,Edificio de Cultura,Biblioteca Popular,Biblioteca Popular Paula Albarracín de Sarmiento,-59.1568,-37.2929,
Tandil,06791,Edificio de Cultura,Biblioteca Popular,Biblioteca Popular Sarmiento- Villa Italia- Tandil,-59.1587,-37.2949,
Tandil,06791,Edificio de Cultura,Biblioteca Popular,Biblioteca Popular Bepo Ghezzi,-59.1634,-37.3186,
Tandil,06791,Edificio de Cultura,Biblioteca Popular,Biblioteca Popular José Ingenieros,-59.5075,-37.3986,
Tapalqué,06798,Edificio de Cultura,Biblioteca Popular,Biblioteca Popular Ramón Desiderio Parodi,-60.0188,-36.3613,
Tapalqué,06798,Edificio de Cultura,Biblioteca Popular Municipal,Biblioteca Popular Municipal José Hernández,-60.0237,-36.3573,
Tapalqué,06798,Edificio de Cultura,Biblioteca Popular,Biblioteca Popular General Bartolomé Mitre,-60.0242,-36.358,
Tapalqué,06798,Edificio de Cultura,Museo y Centro de Cultura,Museo y Centro de Cultura,-60.0243,-36.355,
Tapalqué,06798,Edificio de Cultura,Biblioteca Popular,Biblioteca Popular General San Martín,-60.0287,-36.3518,
Tigre,06805,Edificio de Cultura,Teatro,Teatro Nini Marshall,-58.5763,-34.4182,
Tigre,06805,Edificio de Cultura,Centro Cultural,Centro Cultural Comunitario y Biblioteca Popular Caraguata,-58.5809,-34.4227,
Tigre,06805,Edificio de Cultura,Biblioteca Popular,Biblioteca Popular Domingo Faustino Sarmiento,-58.5846,-34.4202,
Tigre,06805,Edificio de Cultura,Museo,Museo Naval de La Nación,-58.5862,-34.4129,
Tigre,06805,Edificio de Cultura,Museo,Museo Histórico de La Prefectura Naval Argentina,-58.5878,-34.4208,
Tigre,06805,Edificio de Cultura,Museo,Museo de la Reconquista,-58.59,-34.4166,
Tigre,06805,Edificio de Cultura,Museo,Museo de Arte Tigre,-58.591,-34.4089,
Tigre,06805,Edificio de Cultura,Biblioteca Popular,Biblioteca Popular Troncos del Talar,-58.6039,-34.4507,
Tigre,06805,Edificio de Cultura,Biblioteca Popular,Biblioteca Popular Mariano Moreno,-58.609,-34.4822,
Tigre,06805,Edificio de Cultura,Biblioteca Popular,Biblioteca Popular Constancio C.Vigil,-58.611,-34.3955,
Tigre,06805,Edificio de Cultura,Biblioteca Popular y del Cine,Biblioteca Popular y del Cine Leonardo Favio,-58.6206,-34.4849,
Tigre,06805,Edificio de Cultura,Biblioteca Popular,Biblioteca Popular Juan José Castelli,-58.6344,-34.4541,
Tigre,06805,Edificio de Cultura,Biblioteca Popular,Biblioteca Popular José Ingenieros,-58.6349,-34.494,
Tigre,06805,Edificio de Cultura,Biblioteca Popular,Biblioteca Popular Unión de Educ. de Tigre,-58.6418,-34.4594,
Tigre,06805,Edificio de Cultura,Teatro,Teatro Hindu,-58.6438,-34.5001,
Tigre,06805,Edificio de Cultura,Biblioteca Popular y Centro Cultural,Biblioteca Popular y Centro Cultural El talar,-58.6459,-34.4657,
Tigre,06805,Edificio de Cultura,Biblioteca Popular,Biblioteca Popular Ricardo Rojas,-58.6784,-34.4599,
Tigre,06805,Edificio de Cultura,Biblioteca Popular,Biblioteca Popular Lopez Camelo,-58.6953,-34.4489,
Tigre,06805,Edificio de Cultura,Biblioteca Popular,Biblioteca Popular Ricardo Güiraldes,-58.6985,-34.4124,
Tordillo,06812,Edificio de Cultura,Biblioteca Municipal Popular,Biblioteca Municipal Popular José Manuel Estrada,-57.3241,-36.5183,
Tornquist,06819,Edificio de Cultura,Biblioteca Popular,Biblioteca Popular General San Martin,-61.7702,-38.2049,
Tornquist,06819,Edificio de Cultura,Biblioteca Popular,Biblioteca Popular Mariano Moreno,-61.794,-38.1341,
Tornquist,06819,Edificio de Cultura,Asociación Biblioteca Popular,Asociación Biblioteca Popular Macedonio Fernández,-61.9349,-38.0856,
Tornquist,06819,Edificio de Cultura,Museo,Museo Histórico Regional Fuerte Argentino,-62.2242,-38.1021,
Tornquist,06819,Edificio de Cultura,Teatro,Teatro Municipal Rodolfo Funke Torquinst,-62.2243,-38.1006,
Tornquist,06819,Edificio de Cultura,Biblioteca Popular,Biblioteca Popular Ernesto Tornquist,-62.2247,-38.1016,
Tornquist,06819,Edificio de Cultura,Biblioteca Popular,Biblioteca Popular Juan F. Cornaccini,-62.7,-38.1833,
Trenque Lauquen,06826,Edificio de Cultura,Museo,Museo Histórico de Las Campañas al Desierto General Conrado E. Villegas,-62.727,-35.9791,
Trenque Lauquen,06826,Edificio de Cultura,Biblioteca Popular Pública,Biblioteca Popular Pública Rivadavia,-62.7322,-35.9747,
Trenque Lauquen,06826,Edificio de Cultura,Biblioteca Popular,Biblioteca Popular Bartolomé Mitre,-62.7404,-35.9793,
Tres Arroyos,06833,Edificio de Cultura,Biblioteca Popular Pública,Biblioteca Popular Pública Amigos del libro,-59.7823,-38.6874,
Tres Arroyos,06833,Edificio de Cultura,Biblioteca Popular,Biblioteca Popular San Francisco de Bellocq,-60.0151,-38.6913,
Tres Arroyos,06833,Edificio de Cultura,Museo,Museo Regional de Claromecó Aníbal Paz,-60.074,-38.8579,
Tres Arroyos,06833,Edificio de Cultura,Biblioteca Popular,Biblioteca Popular Doctor B.A. Houssay,-60.0742,-38.8573,
Tres Arroyos,06833,Edificio de Cultura,Biblioteca Popular,Biblioteca Popular Domingo Faustino Sarmiento,-60.2723,-38.3792,
Tres Arroyos,06833,Edificio de Cultura,Museo,Museo de Bellas Artes de Tres Arroyos,-60.2733,-38.3785,
Tres Arroyos,06833,Edificio de Cultura,Cine,Cine El Solar del Tortoni,-60.2742,-38.3797,
Tres Arroyos,06833,Edificio de Cultura,Biblioteca Popular,Biblioteca Popular Vicente P. Cacuri,-60.275,-38.3795,
Tres Arroyos,06833,Edificio de Cultura,Biblioteca Popular,Biblioteca Popular Doctor José Campano,-60.276,-38.3804,
Tres Arroyos,06833,Edificio de Cultura,Museo,Museo Municipal José A. Mulazzi,-60.2788,-38.3744,
Tres Arroyos,06833,Edificio de Cultura,Biblioteca Popular,Biblioteca Popular José Ingenieros,-60.2808,-38.3789,
Tres Arroyos,06833,Edificio de Cultura,Biblioteca Popular,Biblioteca Popular La Tranquera,-60.292,-38.3643,
Tres Arroyos,06833,Edificio de Cultura,Biblioteca Popular,Biblioteca Popular Un mundo de libros,-60.3439,-38.8911,
Tres Arroyos,06833,Edificio de Cultura,Biblioteca Popular,Biblioteca Popular Almafuerte,-60.4524,-38.7229,
Tres Arroyos,06833,Edificio de Cultura,Biblioteca Popular,Biblioteca Popular Luz y Cultura,-60.467,-38.4946,
Tres de Febrero,06840,Edificio de Cultura,Instituto y Biblioteca Popular,Instituto y Biblioteca Popular Almafuerte,-58.5291,-34.6046,
Tres de Febrero,06840,Edificio de Cultura,Asociación Cultural y Biblioteca Popular,Asociación Cultural y Biblioteca Popular Mariano Moreno,-58.5299,-34.6007,
Tres de Febrero,06840,Edificio de Cultura,Biblioteca Popular,Biblioteca Popular José Ingenieros,-58.5389,-34.6177,
Tres de Febrero,06840,Edificio de Cultura,Otro,La Brújula al Oeste,-58.5424,-34.6381,
Tres de Febrero,06840,Edificio de Cultura,Biblioteca Popular,Biblioteca Popular Domingo Faustino Sarmiento,-58.5426,-34.6022,
Tres de Febrero,06840,Edificio de Cultura,Museo,Museo Histórico del Ejército Argentino,-58.5434,-34.6308,
Tres de Febrero,06840,Edificio de Cultura,Cine Teatro,Cine Teatro Ocean,-58.5439,-34.6013,
Tres de Febrero,06840,Edificio de Cultura,Biblioteca Popular,Biblioteca Popular Etelvina L. de Giorello,-58.5498,-34.6032,
Tres de Febrero,06840,Edificio de Cultura,Biblioteca Popular,Biblioteca Popular 15 de Agosto,-58.5514,-34.6178,
Tres de Febrero,06840,Edificio de Cultura,Biblioteca Popular,Biblioteca Popular General San Martín,-58.5587,-34.6035,
Tres de Febrero,06840,Edificio de Cultura,Biblioteca Popular,Biblioteca Popular Bartolomé Mitre,-58.5632,-34.6101,
Tres de Febrero,06840,Edificio de Cultura,Cine Teatro,Cine Teatro Paramount,-58.564,-34.6054,
Tres de Febrero,06840,Edificio de Cultura,Biblioteca Popular,Biblioteca Popular Patria y Labor,-58.565,-34.6099,
Tres de Febrero,06840,Edificio de Cultura,Biblioteca Popular,Biblioteca Popular Juan Bautista Alberdi,-58.5657,-34.6079,
Tres de Febrero,06840,Edificio de Cultura,Cine Teatro,Cine Teatro Helios,-58.5929,-34.6039,
Tres de Febrero,06840,Edificio de Cultura,Biblioteca Popular,Biblioteca Popular Ciudad Jardin,-58.5939,-34.5977,
Tres de Febrero,06840,Edificio de Cultura,Teatro,Teatro El Baldio,-58.5947,-34.5981,
Tres de Febrero,06840,Edificio de Cultura,Biblioteca Popular,Biblioteca Popular Juan Manuel Giufra,-58.5953,-34.6066,
Tres Lomas,06847,Edificio de Cultura,Biblioteca Popular,Biblioteca Popular Bernardino Rivadavia,-62.8583,-36.4618,
Vicente López,06861,Edificio de Cultura,Museo,Museo Rómulo Raggio,-58.4757,-34.5277,
Vicente López,06861,Edificio de Cultura,Biblioteca Popular,Biblioteca Popular Sudestada,-58.4786,-34.5371,
Vicente López,06861,Edificio de Cultura,Otro,Foro de las Ciencias y las Artes,-58.4792,-34.5318,
Vicente López,06861,Edificio de Cultura,Biblioteca Popular,Biblioteca Popular Bernardo Delom,-58.4826,-34.5257,
Vicente López,06861,Edificio de Cultura,Teatro,Teatro de Repertorio del Norte,-58.4832,-34.531,
Vicente López,06861,Edificio de Cultura,Cine Teatro,Cine Teatro York,-58.485,-34.5077,
Vicente López,06861,Edificio de Cultura,Casa de la Cultura Municipal,Casa de la Cultura Municipal,-58.4859,-34.5094,
Vicente López,06861,Edificio de Cultura,Biblioteca Popular,Biblioteca Popular Vicente Lopez y Planes,-58.4915,-34.5094,
Vicente López,06861,Edificio de Cultura,Museo,Museo Forrajería De La Familia García,-58.4916,-34.5269,
Vicente López,06861,Edificio de Cultura,Otro,Núcleo Espacio Artístico,-58.4927,-34.5069,
Vicente López,06861,Edificio de Cultura,Biblioteca Popular,Biblioteca Popular Arandu,-58.4933,-34.5202,
Vicente López,06861,Edificio de Cultura,Museo,Museo de la Piedra Argentina,-58.4969,-34.544,
Vicente López,06861,Edificio de Cultura,Biblioteca Popular,Biblioteca Popular León Adolfo Vienni,-58.5026,-34.5468,
Vicente López,06861,Edificio de Cultura,Biblioteca Popular,Biblioteca Popular Nora Bombelli,-58.5112,-34.5328,
Vicente López,06861,Edificio de Cultura,Museo,Museo del Cine Lumiton,-58.5159,-34.5279,
Vicente López,06861,Edificio de Cultura,Centro Cultural Municipal,Centro Cultural Municipal Munro,-58.5239,-34.5304,
Vicente López,06861,Edificio de Cultura,Biblioteca Popular,Biblioteca Popular José Murillo,-58.5277,-34.5462,
Villa Gesell,06868,Edificio de Cultura,Teatro,Teatro Gesell Plaza,-56.9697,-37.2571,
Villa Gesell,06868,Edificio de Cultura,Casa de la Cultura,Casa de la Cultura de Villa Gesell,-56.9722,-37.2613,
Villa Gesell,06868,Edificio de Cultura,Biblioteca Popular,Biblioteca Popular Rafael Obligado,-56.9723,-37.2546,
Villa Gesell,06868,Edificio de Cultura,Otro,La Casa de los Artistas,-56.9867,-37.2757,
Villa Gesell,06868,Edificio de Cultura,Asociación de Fomento,Asociación de Fomento Atlántica y Biblioteca Popular,-56.9895,-37.2692,
Villa Gesell,06868,Edificio de Cultura,Centro Cultural,Centro Cultural Homero Manzi,-56.9913,-37.2832,
Villarino,06875,Edificio de Cultura,Biblioteca Popular,Biblioteca Popular Argerich,-62.6056,-38.7735,
Villarino,06875,Edificio de Cultura,Biblioteca Popular Escolar,Biblioteca Popular Escolar Cervantes,-62.6089,-39.2595,
Villarino,06875,Edificio de Cultura,Biblioteca Popular,Biblioteca Popular Hilario Ascasubi,-62.65,-39.3762,
Villarino,06875,Edificio de Cultura,Biblioteca Popular Pública,Biblioteca Popular Pública Bartolomé Mitre,-62.6957,-38.8238,
Zárate,06882,Edificio de Cultura,Biblioteca Popular,Biblioteca Popular Domingo Faustino Sarmiento,-59.021,-34.1008,
Zárate,06882,Edificio de Cultura,Biblioteca Popular Pública Municipal,Biblioteca Popular Pública Municipal Doctor H. Pérez de la Torre,-59.0211,-34.1012,
Zárate,06882,Edificio de Cultura,Cine Teatro,Cine Teatro Coliseo,-59.0221,-34.0975,
,,,,,,,
,,,,,,,
,,,,,,,
,,,,,,,
,,,,,,,
,,,,,,,
